id;titulo;precio;img;detalle;descripcion
1;Avengers;15000;img/posters/avengers1.jpg;detalle.html?id=1;Avengers es una película de superhéroes basada en el equipo de superhéroes de Marvel Comics del mismo nombre. La película fue dirigida por Joss Whedon y cuenta con un elenco estelar que incluye a Robert Downey Jr., Chris Evans, Mark Ruffalo, Chris Hemsworth, Scarlett Johansson y Jeremy Renner. La trama sigue a los Vengadores mientras se unen para detener a Loki, el hermano adoptivo de Thor, quien planea conquistar la Tierra con la ayuda de un ejército alienígena.
2;Harry Potter 7 pt2;16000;img/posters/hp8.jpg;detalle.html?id=2;Harry Potter y las Reliquias de la Muerte, Parte 2 es una película de fantasía y aventura dirigida por David Yates. La película es la continuación de la saga de Harry Potter y presenta a los protagonistas en su último ańo en el colegio Hogwarts.
3;Batman Begins;16000;img/posters/batman1.jpg;detalle.html?id=3;Batman Begins es una película de superhéroes dirigida por Christopher Nolan. La película cuenta la historia del origen de Batman, desde la muerte de sus padres hasta su transformación en el Caballero Oscuro. La trama sigue a Bruce Wayne mientras lucha contra el crimen en Gotham City y enfrenta a villanos como Ra's al Ghul y el Espantapájaros.
4;Star Wars Episode I;15000;img/posters/sw.jpg;detalle.html?id=4;Star Wars: Episode I - The Phantom Menace es una película de ciencia ficción y aventura dirigida por George Lucas. La película es la primera entrega de la trilogía de precuelas de Star Wars y sigue a los personajes Obi-Wan Kenobi y Qui-Gon Jinn mientras intentan proteger a la joven Anakin Skywalker y enfrentarse al malvado Darth Maul.
5;Stranger Things;15000;img/posters/st.jpg;detalle.html?id=5;Stranger Things es una serie de televisión de ciencia ficción y terror creada por los hermanos Duffer. La serie se desarrolla en la década de 1980 en el pueblo ficticio de Hawkins, Indiana, y sigue a un grupo de nińos mientras investigan la desaparición de su amigo Will Byers y descubren la existencia de un mundo paralelo llamado 'El Otro Lado'.
6;Game of Thrones;16000;img/posters/got.jpg;detalle.html?id=6;Game of Thrones es una serie de televisión de fantasía y drama basada en la saga de novelas 'Canción de Hielo y Fuego' de George R.R. Martin. La serie se desarrolla en los continentes ficticios de Westeros y Essos, y sigue las luchas de varias familias nobles por el control del Trono de Hierro y el destino de los Siete Reinos.
7;The Last of Us;16000;img/posters/tlou.jpg;detalle.html?id=7;The Last of Us es una serie de televisión de drama y acción basada en el popular videojuego del mismo nombre desarrollado por Naughty Dog. La serie sigue a Joel y Ellie, dos sobrevivientes en un mundo post-apocalíptico devastado por una infección fúngica que ha convertido a gran parte de la población en criaturas agresivas. A medida que viajan a través de Estados Unidos, enfrentan peligros tanto humanos como infectados mientras desarrollan un vínculo profundo.
8;Daredevil;15000;img/posters/daredevil.jpg;detalle.html?id=8;Daredevil es una serie de televisión de superhéroes basada en el personaje de Marvel Comics del mismo nombre. La serie sigue a Matt Murdock, un abogado ciego que lucha contra el crimen en la ciudad de Nueva York como el vigilante Daredevil. A lo largo de la serie, Murdock enfrenta a villanos peligrosos y se enfrenta a dilemas morales mientras protege a los inocentes y busca justicia.
